{
  "schemaVersion": "1",
  "kind": "sparse-experiment-gates/v1",
  "corpusManifestSha256": "351cfb362d798a47054993708ecfbec6c42d289f2e1d3bdc0b514c2d3b9f9435",
  "observationsSha256": "566894dce897843c169a18354a6e867650c0bc74172a729f65cea7912f1e04c9",
  "variants": [
    {
      "id": "sarif-only-control",
      "metrics": {
        "acceptedPairs": 0,
        "truePositives": 0,
        "falsePositives": 0,
        "falseNegatives": 19,
        "precision": 1,
        "recall": 0,
        "f1": 0
      },
      "byFamily": [
        {
          "familyId": "pmd-clean-a",
          "metrics": {
            "acceptedPairs": 0,
            "truePositives": 0,
            "falsePositives": 0,
            "falseNegatives": 8,
            "precision": 1,
            "recall": 0,
            "f1": 0
          }
        },
        {
          "familyId": "pmd-clean-b",
          "metrics": {
            "acceptedPairs": 0,
            "truePositives": 0,
            "falsePositives": 0,
            "falseNegatives": 11,
            "precision": 1,
            "recall": 0,
            "f1": 0
          }
        }
      ],
      "classification": {
        "matchedRelationships": 0,
        "classificationMismatches": 0
      },
      "lifecycle": {
        "expectedNew": 3,
        "correctNew": 3,
        "incorrectNew": 0,
        "expectedResolved": 3,
        "correctResolved": 3,
        "incorrectResolved": 0
      },
      "ambiguity": {
        "labelledUnits": 3,
        "correctRefusals": 3,
        "incorrectAutoMatches": 0
      },
      "ingestion": {
        "casesEvaluated": 4,
        "failures": 0,
        "structuralFailures": 0
      },
      "security": {
        "baselineReadsFromCandidateRoot": 0,
        "candidateReadsFromBaselineRoot": 0,
        "containmentViolations": 0,
        "rootConfusions": 0
      },
      "productionApplicability": {
        "trustedTreeHashPreflightEnabled": false,
        "metricsWithoutTrustedTreeHashes": {
          "acceptedPairs": 0,
          "truePositives": 0,
          "falsePositives": 0,
          "falseNegatives": 19,
          "precision": 1,
          "recall": 0,
          "f1": 0
        },
        "scenariosWithoutTrustedTreeHashes": [
          {
            "scenarioId": "exact-unchanged-source-location",
            "families": [
              {
                "familyId": "pmd-clean-a",
                "assertionsPassed": true,
                "preflightAccepted": true,
                "acceptedRelationships": 0,
                "affectedEndpointMatches": 0,
                "baselineReadsFromCandidateRoot": 0,
                "candidateReadsFromBaselineRoot": 0,
                "containmentViolations": 0,
                "unexplainedIngestionFailures": 0,
                "structuralFailures": 0
              },
              {
                "familyId": "pmd-clean-b",
                "assertionsPassed": true,
                "preflightAccepted": true,
                "acceptedRelationships": 0,
                "affectedEndpointMatches": 0,
                "baselineReadsFromCandidateRoot": 0,
                "candidateReadsFromBaselineRoot": 0,
                "containmentViolations": 0,
                "unexplainedIngestionFailures": 0,
                "structuralFailures": 0
              }
            ]
          },
          {
            "scenarioId": "region-drift-equivalent-token-context",
            "families": [
              {
                "familyId": "pmd-clean-a",
                "assertionsPassed": true,
                "preflightAccepted": true,
                "acceptedRelationships": 0,
                "affectedEndpointMatches": 0,
                "baselineReadsFromCandidateRoot": 0,
                "candidateReadsFromBaselineRoot": 0,
                "containmentViolations": 0,
                "unexplainedIngestionFailures": 0,
                "structuralFailures": 0
              },
              {
                "familyId": "pmd-clean-b",
                "assertionsPassed": true,
                "preflightAccepted": true,
                "acceptedRelationships": 0,
                "affectedEndpointMatches": 0,
                "baselineReadsFromCandidateRoot": 0,
                "candidateReadsFromBaselineRoot": 0,
                "containmentViolations": 0,
                "unexplainedIngestionFailures": 0,
                "structuralFailures": 0
              }
            ]
          },
          {
            "scenarioId": "file-method-movement-equivalent-token-context",
            "families": [
              {
                "familyId": "pmd-clean-a",
                "assertionsPassed": true,
                "preflightAccepted": true,
                "acceptedRelationships": 0,
                "affectedEndpointMatches": 0,
                "baselineReadsFromCandidateRoot": 0,
                "candidateReadsFromBaselineRoot": 0,
                "containmentViolations": 0,
                "unexplainedIngestionFailures": 0,
                "structuralFailures": 0
              },
              {
                "familyId": "pmd-clean-b",
                "assertionsPassed": true,
                "preflightAccepted": true,
                "acceptedRelationships": 0,
                "affectedEndpointMatches": 0,
                "baselineReadsFromCandidateRoot": 0,
                "candidateReadsFromBaselineRoot": 0,
                "containmentViolations": 0,
                "unexplainedIngestionFailures": 0,
                "structuralFailures": 0
              }
            ]
          },
          {
            "scenarioId": "repeated-context-ambiguity",
            "families": [
              {
                "familyId": "pmd-clean-a",
                "assertionsPassed": true,
                "preflightAccepted": true,
                "acceptedRelationships": 0,
                "affectedEndpointMatches": 0,
                "baselineReadsFromCandidateRoot": 0,
                "candidateReadsFromBaselineRoot": 0,
                "containmentViolations": 0,
                "unexplainedIngestionFailures": 0,
                "structuralFailures": 0
              },
              {
                "familyId": "pmd-clean-b",
                "assertionsPassed": true,
                "preflightAccepted": true,
                "acceptedRelationships": 0,
                "affectedEndpointMatches": 0,
                "baselineReadsFromCandidateRoot": 0,
                "candidateReadsFromBaselineRoot": 0,
                "containmentViolations": 0,
                "unexplainedIngestionFailures": 0,
                "structuralFailures": 0
              }
            ]
          },
          {
            "scenarioId": "missing-source-file",
            "families": [
              {
                "familyId": "pmd-clean-a",
                "assertionsPassed": true,
                "preflightAccepted": true,
                "acceptedRelationships": 0,
                "affectedEndpointMatches": 0,
                "baselineReadsFromCandidateRoot": 0,
                "candidateReadsFromBaselineRoot": 0,
                "containmentViolations": 0,
                "unexplainedIngestionFailures": 0,
                "structuralFailures": 0
              },
              {
                "familyId": "pmd-clean-b",
                "assertionsPassed": true,
                "preflightAccepted": true,
                "acceptedRelationships": 0,
                "affectedEndpointMatches": 0,
                "baselineReadsFromCandidateRoot": 0,
                "candidateReadsFromBaselineRoot": 0,
                "containmentViolations": 0,
                "unexplainedIngestionFailures": 0,
                "structuralFailures": 0
              }
            ]
          },
          {
            "scenarioId": "mismatched-source-snapshot",
            "families": [
              {
                "familyId": "pmd-clean-a",
                "assertionsPassed": true,
                "preflightAccepted": true,
                "acceptedRelationships": 0,
                "affectedEndpointMatches": 0,
                "baselineReadsFromCandidateRoot": 0,
                "candidateReadsFromBaselineRoot": 0,
                "containmentViolations": 0,
                "unexplainedIngestionFailures": 0,
                "structuralFailures": 0
              },
              {
                "familyId": "pmd-clean-b",
                "assertionsPassed": true,
                "preflightAccepted": true,
                "acceptedRelationships": 0,
                "affectedEndpointMatches": 0,
                "baselineReadsFromCandidateRoot": 0,
                "candidateReadsFromBaselineRoot": 0,
                "containmentViolations": 0,
                "unexplainedIngestionFailures": 0,
                "structuralFailures": 0
              }
            ]
          },
          {
            "scenarioId": "baseline-root-bound-to-candidate",
            "families": [
              {
                "familyId": "pmd-clean-a",
                "assertionsPassed": true,
                "preflightAccepted": true,
                "acceptedRelationships": 0,
                "affectedEndpointMatches": 0,
                "baselineReadsFromCandidateRoot": 0,
                "candidateReadsFromBaselineRoot": 0,
                "containmentViolations": 0,
                "unexplainedIngestionFailures": 0,
                "structuralFailures": 0
              },
              {
                "familyId": "pmd-clean-b",
                "assertionsPassed": true,
                "preflightAccepted": true,
                "acceptedRelationships": 0,
                "affectedEndpointMatches": 0,
                "baselineReadsFromCandidateRoot": 0,
                "candidateReadsFromBaselineRoot": 0,
                "containmentViolations": 0,
                "unexplainedIngestionFailures": 0,
                "structuralFailures": 0
              }
            ]
          },